{
  "$schema": "./guard-policy.schema.json",
  "schemaVersion": 1,
  "purpose": "Source of truth for Copilot CLI guard policy. Wrappers and docs must stay consistent with this policy.",
  "responsePolicy": {
    "permissionRequest": {
      "deny": "return deny response with interrupt=true",
      "ask": "do not ask here; fall through to normal permission flow"
    },
    "preToolUse": {
      "deny": "return deny response",
      "ask": "return ask response for protected path changes"
    }
  },
  "pathPropertyNames": [
    "path",
    "filePath",
    "file_path",
    "targetPath",
    "target_path"
  ],
  "toolNames": {
    "shell": [
      "bash",
      "powershell"
    ],
    "fileWrite": [
      "create",
      "edit"
    ],
    "observe": [
      "view",
      "web_fetch"
    ],
    "delegation": [
      "task"
    ]
  },
  "protectedPaths": [
    {
      "id": "repo-hooks",
      "path": ".github/hooks/**",
      "scope": "directory",
      "action": "ask",
      "maintenanceScope": "protectedPathEdit"
    },
    {
      "id": "repo-githooks",
      "path": ".githooks/**",
      "scope": "directory",
      "action": "ask",
      "maintenanceScope": "protectedPathEdit"
    },
    {
      "id": "repo-workflows",
      "path": ".github/workflows/**",
      "scope": "directory",
      "action": "ask",
      "maintenanceScope": "protectedPathEdit"
    },
    {
      "id": "repo-instructions-dir",
      "path": ".github/instructions/**",
      "scope": "directory",
      "action": "ask",
      "maintenanceScope": "protectedPathEdit"
    },
    {
      "id": "repo-skills-dir",
      "path": ".github/skills/**",
      "scope": "directory",
      "action": "ask",
      "maintenanceScope": "protectedPathEdit"
    },
    {
      "id": "agents-skills-dir",
      "path": ".agents/skills/**",
      "scope": "directory",
      "action": "ask",
      "maintenanceScope": "protectedPathEdit"
    },
    {
      "id": "claude-skills-dir",
      "path": ".claude/skills/**",
      "scope": "directory",
      "action": "ask",
      "maintenanceScope": "protectedPathEdit"
    },
    {
      "id": "repo-copilot-instructions",
      "path": ".github/copilot-instructions.md",
      "scope": "file",
      "action": "ask",
      "maintenanceScope": "protectedPathEdit"
    },
    {
      "id": "repo-mcp",
      "path": ".github/mcp.json",
      "scope": "file",
      "action": "ask",
      "maintenanceScope": "protectedPathEdit"
    },
    {
      "id": "root-mcp",
      "path": ".mcp.json",
      "scope": "file",
      "action": "ask",
      "maintenanceScope": "protectedPathEdit"
    },
    {
      "id": "gitleaks-config",
      "path": ".gitleaks.toml",
      "scope": "file",
      "action": "ask",
      "maintenanceScope": "protectedPathEdit"
    },
    {
      "id": "security-policy",
      "path": "SECURITY.md",
      "scope": "file",
      "action": "ask",
      "maintenanceScope": "protectedPathEdit"
    },
    {
      "id": "trust-boundary-doc",
      "path": "docs/TRUST_BOUNDARY.md",
      "scope": "file",
      "action": "ask",
      "maintenanceScope": "protectedPathEdit"
    },
    {
      "id": "hooks-governance-doc",
      "path": "docs/HOOKS_GOVERNANCE.md",
      "scope": "file",
      "action": "ask",
      "maintenanceScope": "protectedPathEdit"
    },
    {
      "id": "enterprise-security-review-doc",
      "path": "docs/ENTERPRISE_SECURITY_REVIEW.md",
      "scope": "file",
      "action": "ask",
      "maintenanceScope": "protectedPathEdit"
    },
    {
      "id": "guard-policy-json",
      "path": "policy/guard-policy.json",
      "scope": "file",
      "action": "ask",
      "maintenanceScope": "protectedPathEdit"
    },
    {
      "id": "guard-policy-schema",
      "path": "policy/guard-policy.schema.json",
      "scope": "file",
      "action": "ask",
      "maintenanceScope": "protectedPathEdit"
    },
    {
      "id": "maintenance-mode-state",
      "path": "$HOME/.copilot/maintenance-mode.json",
      "scope": "file",
      "action": "deny",
      "maintenanceScope": null
    },
    {
      "id": "home-copilot-root",
      "path": "$HOME/.copilot/**",
      "scope": "directory",
      "action": "ask",
      "maintenanceScope": null
    }
  ],
  "denyCommandRules": [
    {
      "id": "maintenance-mode-manual-only",
      "kind": "specialized",
      "description": "AI must not enter or exit maintenance mode, or edit the maintenance state file."
    },
    {
      "id": "git-hooks-no-verify",
      "kind": "specialized",
      "description": "Block git commit --no-verify, git commit -n, and git push --no-verify."
    },
    {
      "id": "git-hooks-path-change",
      "kind": "specialized",
      "description": "Block core.hooksPath writes, unsets, and inline git -c core.hooksPath usage."
    },
    {
      "id": "git-hooks-update-index-bypass",
      "kind": "specialized",
      "description": "Block git update-index --skip-worktree and --assume-unchanged."
    },
    {
      "id": "git-push-force",
      "kind": "specialized",
      "description": "Block git push -f, --force, and --force-with-lease."
    },
    {
      "id": "git-commit-secret-scan",
      "kind": "specialized",
      "description": "Run staged gitleaks scan before git commit."
    },
    {
      "id": "git-push-secret-scan",
      "kind": "specialized",
      "description": "Run unpushed-commit gitleaks scan before git push."
    },
    {
      "id": "gh-pr-create-secret-scan",
      "kind": "specialized",
      "description": "Run unpushed-commit gitleaks scan before gh pr create."
    },
    {
      "id": "rm-rf-root",
      "kind": "pattern",
      "matchAgainst": "normalized",
      "description": "Block recursive forced rm against root.",
      "pattern": "(^|[;&|]\\s*)(?:(?:sudo|doas)\\s+)?(?:(?:cmd|cmd\\.exe)\\s+\\/c\\s+)?(?:(?:sudo|doas)\\s+)?rm[^;&|]*\\s-[a-z]*r[a-z]*f[a-z]*[^;&|]*\\s+\\/(?=\\s|$|[;&|])"
    },
    {
      "id": "rm-fr-root",
      "kind": "pattern",
      "matchAgainst": "normalized",
      "description": "Block forced recursive rm against root.",
      "pattern": "(^|[;&|]\\s*)(?:(?:sudo|doas)\\s+)?(?:(?:cmd|cmd\\.exe)\\s+\\/c\\s+)?(?:(?:sudo|doas)\\s+)?rm[^;&|]*\\s-[a-z]*f[a-z]*r[a-z]*[^;&|]*\\s+\\/(?=\\s|$|[;&|])"
    },
    {
      "id": "rm-r-f-root",
      "kind": "pattern",
      "matchAgainst": "normalized",
      "description": "Block split recursive forced rm against root.",
      "pattern": "(^|[;&|]\\s*)(?:(?:sudo|doas)\\s+)?(?:(?:cmd|cmd\\.exe)\\s+\\/c\\s+)?(?:(?:sudo|doas)\\s+)?rm[^;&|]*\\s-[a-z]*r[a-z]*(?=\\s|$|[;&|])[^;&|]*\\s-[a-z]*f[a-z]*[^;&|]*\\s+\\/(?=\\s|$|[;&|])"
    },
    {
      "id": "rm-f-r-root",
      "kind": "pattern",
      "matchAgainst": "normalized",
      "description": "Block split forced recursive rm against root.",
      "pattern": "(^|[;&|]\\s*)(?:(?:sudo|doas)\\s+)?(?:(?:cmd|cmd\\.exe)\\s+\\/c\\s+)?(?:(?:sudo|doas)\\s+)?rm[^;&|]*\\s-[a-z]*f[a-z]*(?=\\s|$|[;&|])[^;&|]*\\s-[a-z]*r[a-z]*[^;&|]*\\s+\\/(?=\\s|$|[;&|])"
    },
    {
      "id": "rm-rf-dot",
      "kind": "pattern",
      "matchAgainst": "normalized",
      "description": "Block recursive forced rm against current directory.",
      "pattern": "(^|[;&|]\\s*)(?:(?:sudo|doas)\\s+)?(?:(?:cmd|cmd\\.exe)\\s+\\/c\\s+)?(?:(?:sudo|doas)\\s+)?rm[^;&|]*\\s-[a-z]*r[a-z]*f[a-z]*[^;&|]*\\s+\\.(?=\\s|$|[;&|])"
    },
    {
      "id": "rm-fr-dot",
      "kind": "pattern",
      "matchAgainst": "normalized",
      "description": "Block forced recursive rm against current directory.",
      "pattern": "(^|[;&|]\\s*)(?:(?:sudo|doas)\\s+)?(?:(?:cmd|cmd\\.exe)\\s+\\/c\\s+)?(?:(?:sudo|doas)\\s+)?rm[^;&|]*\\s-[a-z]*f[a-z]*r[a-z]*[^;&|]*\\s+\\.(?=\\s|$|[;&|])"
    },
    {
      "id": "rm-r-f-dot",
      "kind": "pattern",
      "matchAgainst": "normalized",
      "description": "Block split recursive forced rm against current directory.",
      "pattern": "(^|[;&|]\\s*)(?:(?:sudo|doas)\\s+)?(?:(?:cmd|cmd\\.exe)\\s+\\/c\\s+)?(?:(?:sudo|doas)\\s+)?rm[^;&|]*\\s-[a-z]*r[a-z]*(?=\\s|$|[;&|])[^;&|]*\\s-[a-z]*f[a-z]*[^;&|]*\\s+\\.(?=\\s|$|[;&|])"
    },
    {
      "id": "rm-f-r-dot",
      "kind": "pattern",
      "matchAgainst": "normalized",
      "description": "Block split forced recursive rm against current directory.",
      "pattern": "(^|[;&|]\\s*)(?:(?:sudo|doas)\\s+)?(?:(?:cmd|cmd\\.exe)\\s+\\/c\\s+)?(?:(?:sudo|doas)\\s+)?rm[^;&|]*\\s-[a-z]*f[a-z]*(?=\\s|$|[;&|])[^;&|]*\\s-[a-z]*r[a-z]*[^;&|]*\\s+\\.(?=\\s|$|[;&|])"
    },
    {
      "id": "windows-del-force-recursive",
      "kind": "pattern",
      "matchAgainst": "normalized",
      "description": "Block recursive forced del regardless of flag order.",
      "pattern": "(^|[;&|]\\s*)(?:(?:cmd|cmd\\.exe)\\s+\\/c\\s+)?del[^;&|]*\\s\\/f(?=\\s|$|[;&|])[^;&|]*\\s\\/s(?=\\s|$|[;&|])[^;&|]*\\s\\/q(?=\\s|$|[;&|])"
    },
    {
      "id": "windows-del-force-quiet-recursive",
      "kind": "pattern",
      "matchAgainst": "normalized",
      "description": "Block forced quiet recursive del.",
      "pattern": "(^|[;&|]\\s*)(?:(?:cmd|cmd\\.exe)\\s+\\/c\\s+)?del[^;&|]*\\s\\/f(?=\\s|$|[;&|])[^;&|]*\\s\\/q(?=\\s|$|[;&|])[^;&|]*\\s\\/s(?=\\s|$|[;&|])"
    },
    {
      "id": "windows-del-recursive-force-quiet",
      "kind": "pattern",
      "matchAgainst": "normalized",
      "description": "Block recursive forced quiet del.",
      "pattern": "(^|[;&|]\\s*)(?:(?:cmd|cmd\\.exe)\\s+\\/c\\s+)?del[^;&|]*\\s\\/s(?=\\s|$|[;&|])[^;&|]*\\s\\/f(?=\\s|$|[;&|])[^;&|]*\\s\\/q(?=\\s|$|[;&|])"
    },
    {
      "id": "windows-del-recursive-quiet-force",
      "kind": "pattern",
      "matchAgainst": "normalized",
      "description": "Block recursive quiet forced del.",
      "pattern": "(^|[;&|]\\s*)(?:(?:cmd|cmd\\.exe)\\s+\\/c\\s+)?del[^;&|]*\\s\\/s(?=\\s|$|[;&|])[^;&|]*\\s\\/q(?=\\s|$|[;&|])[^;&|]*\\s\\/f(?=\\s|$|[;&|])"
    },
    {
      "id": "windows-del-quiet-force-recursive",
      "kind": "pattern",
      "matchAgainst": "normalized",